{
  "policy_version": "4.0",
  "$schema": "../schema/jd_schema.json",
  "job_id": "redrob_senior_ai_engineer_founding",
  "evaluator_contract": {
    "predicate": "leaf {flag:name} | {flag:name,negate} via {not:{flag}} | {metric:name,op:'<|<=|>|>=|==|!=',value:X} ; node {all:[...]} | {any:[...]} | {not:pred}",
    "multiplier_stage_types": {
      "lookup": "value = map[feature] else default",
      "curve": "bands sorted by 'at'; direction 'min' picks first band where feature>=at; 'max' picks first where feature<=at; at=null is default",
      "conditional": "first case whose 'when' predicate is true -> value; else default",
      "decay": "value = max(floor, base ** feature)",
      "composite_product": "product of member stages, then clamp"
    },
    "pipeline": "score = clamp(career_substance + skill_booster,0,1); for s in multipliers: score*=eval(s); for g in hard_gates: if eval(g.when): score*=g.multiplier. Job-agnostic data-quality penalties are applied separately by the integrity layer."
  },
  "scoring": {
    "uncertain_treatment": {
      "positive_flag_cannot_determine": "false",
      "disqualifier_flag_cannot_determine": "do_not_fire"
    },
    "tie_break": [
      "candidate_id asc"
    ]
  },
  "features": {
    "flags": {
      "slm": [
        "owns_retrieval_prod",
        "vector_db_prod",
        "owns_eval_framework",
        "strong_python_prod",
        "retrieval_ops_depth",
        "owns_ranking_prod",
        "shipped_endtoend_at_scale",
        "ltr_experience",
        "reranker_twostage",
        "relevance_judgment_pipeline",
        "realtime_ml_serving",
        "llm_finetuning",
        "ab_testing_ml",
        "distributed_systems_scale",
        "hrtech_or_marketplace_exp",
        "prod_ml_ops",
        "external_validation",
        "first_person_ownership",
        "primarily_adjacent",
        "observer_not_owner",
        "manager_not_builder",
        "cv_dominant",
        "speech_dominant",
        "robotics_dominant",
        "nlp_ir_significant",
        "research_not_applied",
        "ic_role",
        "llm_api_wrapper_only",
        "pre_llm_ml_production",
        "is_hobbyist_or_self_learner"
      ],
      "deterministic": {
        "current_is_services": "current_company in lookups.company.it_services",
        "majority_career_services": "duration-weighted fraction of career at it_services companies > 0.5",
        "has_product_company": "any career company in lookups.company.product_set",
        "has_ai_native": "any career company in lookups.company.ai_native",
        "titles_escalating": "seniority rank strictly increasing across last 3 employers",
        "is_local": "normalized location in lookups.location.local_cities",
        "prefers_remote": "redrob_signals.preferred_work_mode == 'remote'",
        "open_to_work_flag": "redrob_signals.open_to_work_flag",
        "enterprise_lifer": "every career role at a 10001+ employer (>=2 roles); whole-career big-enterprise tenure the JD warns against"
      }
    },
    "metrics": {
      "years_of_experience": "profile.years_of_experience",
      "applied_ml_years": "min(years_of_experience, sum(role.duration_months/12 * career_ml_credit.factor(role.title)))  [deterministic; no SLM lift]",
      "median_tenure_last_3_months": "median duration_months of last 3 employers",
      "current_role_duration_months": "duration_months of is_current role",
      "last_active_days": "reference_date - redrob_signals.last_active_date, in days",
      "recruiter_response_rate": "redrob_signals.recruiter_response_rate",
      "interview_completion_rate": "redrob_signals.interview_completion_rate",
      "saved_by_recruiters_30d": "redrob_signals.saved_by_recruiters_30d",
      "applications_submitted_30d": "redrob_signals.applications_submitted_30d",
      "notice_period_days": "redrob_signals.notice_period_days",
      "github_activity_score": "redrob_signals.github_activity_score",
      "career_substance": "computed by the career_substance block (available to later stages)",
      "num_qualifying_unevidenced_skills": "count of skill_booster.qualifying skills whose competence flag is not already true"
    },
    "categoricals": {
      "location_relocation_bucket": {
        "derive": "from normalized location + country + willing_to_relocate",
        "values": [
          "local",
          "tier1_relocating",
          "tier1_not_relocating",
          "other_india_relocating",
          "other_india_not_relocating",
          "outside_relocating",
          "outside_not_relocating"
        ]
      },
      "current_title_bucket": {
        "derive": "current_title matched against lookups.title.current_title_buckets",
        "values": [
          "hard_sink",
          "heavy_penalty",
          "neutral_read_description",
          "moderate_positive",
          "strong_positive",
          "ideal"
        ]
      },
      "verification_state": {
        "derive": "verified_email + verified_phone",
        "values": [
          "both",
          "one",
          "neither"
        ]
      }
    }
  },
  "career_substance": {
    "additive": {
      "owns_retrieval_prod": 0.22,
      "owns_eval_framework": 0.18,
      "owns_ranking_prod": 0.14,
      "vector_db_prod": 0.10,
      "shipped_endtoend_at_scale": 0.06,
      "retrieval_ops_depth": 0.08,
      "ltr_experience": 0.06,
      "reranker_twostage": 0.05,
      "relevance_judgment_pipeline": 0.05,
      "realtime_ml_serving": 0.04,
      "llm_finetuning": 0.04,
      "strong_python_prod": 0.04,
      "prod_ml_ops": 0.04,
      "ab_testing_ml": 0.03,
      "distributed_systems_scale": 0.03,
      "hrtech_or_marketplace_exp": 0.03,
      "external_validation": 0.02
    },
    "gates": [
      {
        "when": {
          "flag": "primarily_adjacent"
        },
        "multiplier": 0.55
      },
      {
        "when": {
          "flag": "observer_not_owner"
        },
        "multiplier": 0.65
      },
      {
        "when": {
          "flag": "manager_not_builder"
        },
        "multiplier": 0.35
      },
      {
        "when": {
          "flag": "is_hobbyist_or_self_learner"
        },
        "multiplier": 0.5
      },
      {
        "when": {
          "all": [
            {
              "any": [
                {
                  "flag": "cv_dominant"
                },
                {
                  "flag": "speech_dominant"
                },
                {
                  "flag": "robotics_dominant"
                }
              ]
            },
            {
              "not": {
                "flag": "nlp_ir_significant"
              }
            }
          ]
        },
        "multiplier": 0.25,
        "id": "domain_gate"
      }
    ],
    "clamp": [
      0.0,
      1.0
    ]
  },
  "skill_booster": {
    "when": {
      "metric": "career_substance",
      "op": ">=",
      "value": 0.6
    },
    "per_skill": 0.02,
    "max": 0.06,
    "credit_rule": "count num_qualifying_unevidenced_skills, bonus = min(max, per_skill * count). disqualified skills give zero (not a penalty).",
    "qualifying": [
      "learning to rank",
      "bm25",
      "pgvector",
      "pinecone",
      "weaviate",
      "milvus",
      "qdrant",
      "haystack",
      "opensearch",
      "elasticsearch",
      "lora",
      "qlora",
      "peft",
      "llamaindex",
      "ranking systems",
      "search infrastructure",
      "indexing algorithms",
      "text encoders",
      "information retrieval systems",
      "search backend"
    ],
    "disqualified": [
      "langchain",
      "rag",
      "llms",
      "embeddings",
      "vector search",
      "semantic search",
      "prompt engineering",
      "sentence transformers",
      "hugging face transformers",
      "recommendation systems",
      "information retrieval",
      "mlops",
      "data science",
      "machine learning",
      "nlp",
      "deep learning",
      "ai"
    ]
  },
  "multipliers": [
    {
      "id": "current_title_congruence",
      "type": "lookup",
      "feature": "current_title_bucket",
      "map": {
        "hard_sink": 0.06,
        "heavy_penalty": 0.25,
        "neutral_read_description": 0.55,
        "moderate_positive": 0.8,
        "strong_positive": 0.95,
        "ideal": 1.0
      },
      "default": 0.55
    },
    {
      "id": "company_context",
      "type": "conditional",
      "default": 1.0,
      "cases": [
        {
          "when": {
            "all": [
              {
                "flag": "current_is_services"
              },
              {
                "flag": "has_product_company"
              }
            ]
          },
          "value": 1.0
        },
        {
          "when": {
            "all": [
              {
                "flag": "current_is_services"
              },
              {
                "not": {
                  "flag": "has_product_company"
                }
              }
            ]
          },
          "value": 0.85
        },
        {
          "when": {
            "all": [
              {
                "flag": "majority_career_services"
              },
              {
                "flag": "has_product_company"
              }
            ]
          },
          "value": 0.9
        }
      ]
    },
    {
      "id": "enterprise_lifer_overlay",
      "type": "conditional",
      "default": 1.0,
      "cases": [
        {
          "when": {
            "flag": "enterprise_lifer"
          },
          "value": 0.7
        }
      ]
    },
    {
      "id": "experience_band",
      "type": "curve",
      "feature": "years_of_experience",
      "direction": "min",
      "bands": [
        {
          "at": 14,
          "value": 0.95
        },
        {
          "at": 11,
          "value": 0.98
        },
        {
          "at": 9,
          "value": 1.0
        },
        {
          "at": 6,
          "value": 1.0
        },
        {
          "at": 5,